Title,URL
Naomi issues a statement after Jade Cargill's alleged attackers are revealed on SmackDown,https://www.sportskeeda.com/wwe/news-naomi-issues-statement-jade-cargill-s-alleged-attackers-revealed-smackdown
"Michigan State gave ousted business dean new title, lucrative salary to mend fences",https://www.lansingstatejournal.com/story/news/local/campus/2025/02/13/msu-sanjay-gupta-settlement-broad-business-school/78539291007/
Lawyer for Vince McMahon says criminal probe ‘definitively concluded’ with no charges,https://thehill.com/regulation/court-battles/5141606-mcmahon-probe-dropped/
"TMDX INVESTOR ALERT: TransMedics Group, Inc. Investors with Substantial Losses Have Opportunity to Lead Class Action Lawsuit",https://www.prnewswire.com/news-releases/tmdx-investor-alert-transmedics-group-inc-investors-with-substantial-losses-have-opportunity-to-lead-class-action-lawsuit-302377475.html
Single's Inferno Season 4 star Theo Jang faces backlash over Kanye West Instagram post: 'He is such an Americaboo',https://www.indiatimes.com/trending/singles-inferno-season-4-star-theo-jang-faces-backlash-over-kanye-west-instagram-post-he-is-such-an-americaboo-652797.html
Sexual misconduct allegations rocked this Mass. school last year; what’s happening now,https://www.masslive.com/westernmass/2025/02/sexual-misconduct-allegations-rocked-this-mass-school-last-year-whats-happening-now.html
The Playbook: CEO exits hit a new record high in 2024,https://www.bizjournals.com/pacific/news/2025/02/14/ceo-exits-dress-codes-busy-work-employer-employee.html
"Brad Pitt, Angelina Jolie reach divorce settlement after bitter 8-year legal battle",https://www.msn.com/en-us/entertainment/entertainment-celebrity/brad-pitt-angelina-jolie-reach-divorce-settlement-after-bitter-8-year-legal-battle/ar-AA1wLT3A?ocid=bdt3dhp
Comic takes mickey out of real chief constable's limo scandal in new TV series,https://www.thescottishsun.co.uk/tvandshowbiz/14341047/jack-docherty-takes-mickey-chief-constable-limo-scandal/
"Ryan Edwards Welcomes Baby, Ordered to Pay Child Support",https://www.imdb.com/news/ni65126564/?ref_=nm_nwr_1
Ex-Hawaii CEO gets 87 months for COVID-relief wire fraud,https://www.yahoo.com/news/ex-hawaii-ceo-gets-87-223500720.html
The Gross Law Firm Notifies TELUS International (Cda) Inc. Inves,https://www.gurufocus.com/news/2684324/the-gross-law-firm-notifies-telus-international-cda-inc-investors-of-a-class-action-lawsuit-and-upcoming-deadline-tixt
Two arrested for embezzling funds using ‘Little Hearts’ project name,http://www.adaderana.lk/news/105814/two-arrested-for-embezzling-funds-using-little-hearts-project-name
Police seek man in fraud investigation,https://www.herald.wales/south-wales/police-seek-man-in-fraud-investigation/
Corey Perry releases statement after having contract terminated by Blackhawks,https://www.nbcchicago.com/news/sports/nhl/chicago-blackhawks/corey-perry-releases-statement-after-having-contract-terminated-by-blackhawks/3291838/?os=fuzzscanl12trccccccccccccccccccccccccccccccccccccccccccccccccccccccccccccccccccccccccccccccccccccccccccccccccccccccccccccccccccccccccccccccccccccccccccccccccccccccccccccccccccccc&ref=app
Blake Lively Intensifies Legal Battle with Justin Baldoni,https://www.msn.com/en-us/money/companies/blake-lively-intensifies-legal-battle-with-justin-baldoni/ar-AA1yYgTs
Legal battle over sacked migrant garment workers,https://www.ecotextile.com/2025021454552/news/social-compliance-and-csr/legal-battle-over-sacked-migrant-garment-workers/
Blake Lively Demands Justin Baldoni’s Phone Records In Legal Battle Over Alleged Smear Campaign: “Will Expose The Full Web Of…”,https://www.imdb.com/news/ni65127963/?ref_=nm_nwr_1
Split verdict in contractor fraud case,https://www.wkow.com/news/split-verdict-in-contractor-fraud-case/article_ab77c678-eb4d-11ef-a118-8320e53b055f.html
Mamata Banerjee govt failed to stop atrocities against women: BJP leader Amit Malviya,https://m.economictimes.com/news/politics-and-nation/mamata-banerjee-govt-failed-to-stop-atrocities-against-women-bjp-leader-amit-malviya/articleshow/118274377.cms
"Vatican bank director, his deputy resign amid scandal",https://www.telegraphherald.com/news/business/article_d5fd69ad-8712-5d59-91b3-ccfe845ff646.html
How Mastercard’s CFO views the wave of AI fraud hitting the financial sector,http://www.msn.com/en-us/money/other/how-mastercard-s-cfo-views-the-wave-of-ai-fraud-hitting-the-financial-sector/ar-AA1yKvJK?apiversion=v2&noservercache=1&domshim=1&renderwebcomponents=1&wcseo=1&batchservertelemetry=1&noservertelemetry=1
Transgender controversy in Texas women’s sports: Two ISDs under investigation by Attorney General,https://en.as.com/latest_news/transgender-controversy-in-texas-womens-sports-two-isds-under-investigation-by-attorney-general-n/
State Attorney's Office launches criminal investigation into ferry tragedy,https://glashrvatske.hrt.hr/en/politics/state-attorney-s-office-launches-criminal-investigation-into-ferry-tragedy-12013287
Federal lawsuit challenges Keller ISD election rules amid district split proposal,https://www.cbsnews.com/texas/video/federal-lawsuit-challenges-keller-isd-election-rules-amid-district-split-proposal/
Lawyer gives take on Missouri AG Andrew Bailey filing 'reverse discrimination' lawsuit against Starbucks,http://www.msn.com/en-us/money/companies/lawyer-gives-take-on-missouri-ag-andrew-bailey-filing-reverse-discrimination-lawsuit-against-starbucks/ar-AA1yVigA?apiversion=v2&noservercache=1&domshim=1&renderwebcomponents=1&wcseo=1&batchservertelemetry=1&noservertelemetry=1
Jay-Z's legal battle ends as controversial lawsuit is withdrawn,https://www.tnx.africa/entertainment/article/2001511845/jay-zs-legal-battle-ends-as-controversial-lawsuit-is-withdrawn
Michael Asare Bediako resigns as CEO of Millennium Development Authority,https://www.asaaseradio.com/michael-asare-bediako-resigns-as-ceo-of-millennium-development-authority/
"Lt. Gov. issues statement on passage of SB4, SJR2",https://www.thehendersonnews.com/news/lt-gov-issues-statement-on-passage-of-sb4-sjr2/article_1efa90e2-ea42-11ef-88d3-ff7279a37c06.html
Former banking official imprisoned on charges of embezzlement of 12.3 million dinars,https://libyaobserver.ly/inbrief/former-banking-official-imprisoned-charges-embezzlement-123-million-dinars
NJ town's lawsuit against Islamic congregation has been dismissed,https://www.mycentraljersey.com/story/news/local/middlesex-county/2025/02/15/sayrevilles-lawsuit-against-islamic-congregation-dismissed-in-court/78386326007/
The Inspector General Scandal That Wasn’t,https://freebeacon.com/trump-administration/the-inspector-general-scandal-that-wasnt/
"Academic Senate Session Sees Sudden Resignation over Alleged Administration Misconduct, Receives Info on How to Handle ICE On-Campus, and Continues Contention over the CSU Budget",https://csusignal.com/12585/news/academic-senate-session-sees-sudden-resignation-over-alleged-administration-misconduct-receives-info-on-how-to-handle-ice-on-campus-and-continues-contention-over-the-csu-budget/
"When the MIIF CEO is accused of transferring US$10 million to an odd firm, netizens respond, '30 days in office mpo nie.'",https://www.ghanaweb.com/blogs/rocky55/When-the-MIIF-CEO-is-accused-of-transferring-US-10-million-to-an-odd-firm-netizens-respond-30-days-in-office-mpo-nie-9106
Intel Datacenter Chief Departs To Run Nokia – Now What?,https://www.nextplatform.com/2025/02/10/intel-datacenter-chief-departs-to-run-nokia-now-what/
DOCTOR STRANGE Director Scott Derrickson Departs SNOWPIERCER Over Disagreements With Showrunner,https://comicbookmovie.com/sci_fi/doctor-strange-director-scott-derrickson-departs-snowpiercer-series-over-disagreements-with-the-showrunner-a161775
"SC military school covered up dean, councilman's sexual relationship with student, lawsuit says",https://www.postandcourier.com/education-lab/sc-camden-military-academy-sexual-misconduct-lawsuit/article_e1aa4bf4-eaf2-11ef-8daf-8f67890d09ce.html
Kottayam ragging accused students likely to be terminated; Nursing council mulls strict actions,https://keralakaumudi.com/en/news/news.php?id=1481433&u=
ALAR Investors Have Opportunity to Lead Alarum Technologies Ltd. Securities Fraud Lawsuit with the Schall Law Firm,https://www.businesswire.com/news/home/20250214067108/en/ALAR-Investors-Have-Opportunity-to-Lead-Alarum-Technologies-Ltd.-Securities-Fraud-Lawsuit-with-the-Schall-Law-Firm/?feedref=JjAwJuNHiystnCoBq_hl-XEemlDQ6NgDkiei3bSxnzGlJCVVeQL8sr5Wvng8AXxRSfe41V1BKA-b6v2ZVrSSNs-dUYKiDvY7XniNSqv88QcY1Ge_vf9QIMZ4alzIf_0HE01s4RTGeX_C4TDnN9C9Cg==
Digital Health Co. Beats Some Claims In SPAC Investor Suit,https://www.law360.com/healthcare-authority/articles/2298626/digital-health-co-beats-some-claims-in-spac-investor-suit
Solar Tech Co. SunPower Beats Investor Suit Over Defects,https://www.law360.com/articles/2298637/solar-tech-co-sunpower-beats-investor-suit-over-defects
"Morgan Stanley’s Jon Pruzan, Onetime CEO Candidate, Exits Firm",https://www.wealthmanagement.com/ria-news/morgan-stanley-s-jon-pruzan-onetime-ceo-candidate-exits-firm
"Australian socialite left at the altar lived a life of parties, privilege and scandal",https://www.smh.com.au/culture/celebrity/australian-socialite-left-at-the-altar-lived-a-life-of-parties-privilege-and-scandal-20250214-p5lcah.html
CIDER THIEF ‘SCREAMING OUT FOR HELP’ ORDERED TO PAY £11 TO CO-OP,https://www.islandecho.co.uk/cider-thief-screaming-out-for-help-ordered-to-pay-11-to-co-op/
Cardlytics (CDLX) Faces Investor Lawsuit Over Growth Projections – Hagens Berman,https://www.globenewswire.com/fr/news-release/2025/02/10/3023737/0/en/Cardlytics-CDLX-Faces-Investor-Lawsuit-Over-Growth-Projections-Hagens-Berman.html
"WBA INVESTOR ALERT: Walgreens Boots Alliance, Inc. Investors with Substantial Losses Have Opportunity to Lead Investor Class Action Lawsuit",https://www.prnewswire.com/news-releases/wba-investor-alert-walgreens-boots-alliance-inc-investors-with-substantial-losses-have-opportunity-to-lead-investor-class-action-lawsuit-302377225.html
Vantage Honored with Three Prestigious Awards at the 5th Annual Business Tabloid Awards,https://www.prnewswire.com/news-releases/vantage-honored-with-three-prestigious-awards-at-the-5th-annual-business-tabloid-awards-302377092.html
Florida State Seminoles' Legal Battle: Settlement on the Horizon? | UNC to SEC? - Local 5,https://www.weareiowa.com/video/sports/locked-on/lo-national/acc-show/florida-state-seminoles-legal-battle-settlement-on-the-horizon-unc-to-sec/535-33ffd6da-0921-4406-8215-4f338007857f
Endangering the lives of judges and prosecutors/ State Police justifies the scandal,https://www.cna.al/english/aktualitet/rrezikimi-i-jetes-se-gjyqtareve-dhe-prokuroreve-policia-e-shtetit-jus-i422805
"Air Canada was ordered to pay a passenger $2,000 for delayed luggage. Instead, it's taking him to court",https://www.cbc.ca/news/business/air-canada-delayed-luggage-court-battle-cta-1.7457480
ECOWAS Court Rejects NGOs’ Rights Violation Claims Over Lagdo Dam,https://nannews.ng/2025/02/15/ecowas-court-rejects-ngos-rights-violation-claims-over-lagdo-dam/
"NYC Mayor Adams on allegations by Danielle Sassoon of quid pro quo: ""This is silly""",https://www.msn.com/en-us/news/us/nyc-mayor-adams-on-allegations-by-danielle-sassoon-of-quid-pro-quo-this-is-silly/ar-AA1z47ox
"The feds opened an investigation into a side-hustle company helping pump out AI-generated books, records reveal",https://www.aol.com/feds-opened-investigation-side-hustle-142504926.html?ck_subscriber_id=2604166919&utm_source=convertkit&utm_medium=email&utm_campaign=Publishing%20company%20under%20FTC%20investigation%20-%2016335246&sh_kit=338fcc96f94fad4f497b747e10068264362bd0fa57cc4ef095d7ca280c9a9cb9
"California joins 21 other states to fight NIH cuts that threaten millions in UC, CSU funding",https://www.mercurynews.com/2025/02/10/california-fights-nih-cuts-that-threaten-uc-csu-funding/
"CM Omar Abdullah Calls for Fair Hearing for Terminated Employees, Criticizes Waqf Bill",https://www.knskashmir.com/cm-omar-abdullah-calls-for-fair-hearing-for-terminated-employees--criticizes-waqf-bill-192610
SMTC SHAREHOLDER ALERT: Semtech Corp. Investors are Notified of Pending Securities Fraud Investigation and are Urged to Contact BFA Law,https://www.newsfilecorp.com/release/240635/SMTC-SHAREHOLDER-ALERT-Semtech-Corp.-Investors-are-Notified-of-Pending-Securities-Fraud-Investigation-and-are-Urged-to-Contact-BFA-Law
Mexican President Threatens to File Suit over ‘Gulf of America’,https://www.msn.com/en-us/news/world/mexican-president-threatens-to-file-suit-over-gulf-of-america/ar-AA1z4MQT
"CEO, company director remanded as MACC widens RM2.6mil false claims investigation",https://www.dailyexpress.com.my/news/252197/ceo-company-director-remanded-as-macc-widens-rm2-6mil-false-claims-investigation/
NXT CLASS ACTION: Nextracker Inc. 15% Stock Drop Triggers,https://www.globenewswire.com/news-release/2025/02/10/3023441/0/en/NXT-CLASS-ACTION-Nextracker-Inc-15-Stock-Drop-Triggers-Class-Action-Contact-BFA-Law-before-February-25-Deadline-NASDAQ-NXT.html
U.S. Attorney declines to issue charges from FBI investigation,https://www.twincities.com/2008/06/03/u-s-attorney-declines-to-issue-charges-from-fbi-investigation/
"The Gross Law Firm Announces Class Actions on Behalf of Shareholders of EH, CYDY and LDOS",https://www.accessnewswire.com/newsroom/en/business-and-professional-services/the-gross-law-firm-announces-class-actions-on-behalf-of-sharehold-639955
Kanye West faces new legal setbacks amid harassment and discrimination allegations,https://timesofindia.indiatimes.com/entertainment/english/music/news/kanye-west-faces-new-legal-setbacks-amid-harassment-and-discrimination-allegations/articleshow/118271314.cms
Contra Costa Health CEO is leaving months into DOJ criminal investigation,https://www.msn.com/en-us/health/other/contra-costa-health-ceo-is-leaving-months-into-doj-criminal-investigation/ar-AA1yM9av
Title,URL
"3 more J&K govt employees terminated by L-G, Omar says should be given a chance to prove innocence first",https://indianexpress.com/article/india/jammu-and-kashmir-govt-employees-terminated-l-g-omar-innocence-9837784/
J&K: Three govt employees terminated for their links with terrorists,https://yespunjab.com/jk-three-govt-employees-terminated-for-their-links-with-terrorists/
City Hall probe into Afdlin's alleged misconduct in final stages,https://www.nst.com.my/news/nation/2025/02/1175356/city-hall-probe-afdlins-alleged-misconduct-final-stages
5 big-name golfers who failed to make the cut at Genesis Invitational 2025 ft. Viktor Hovland,https://www.sportskeeda.com/golf/5-big-name-golfers-failed-make-cut-genesis-invitational-2025-ft-viktor-hovland
Peloton wins dismissal of shareholder lawsuit over seat post recall,https://www.reuters.com/business/retail-consumer/peloton-wins-dismissal-shareholder-lawsuit-over-seat-post-recall-2025-02-14/
Houston ISD to join lawsuit against social media companies over student mental health,https://houstonlanding.org/houston-isd-to-join-lawsuit-against-social-media-companies-over-student-mental-health/
"NY Doctor Fined $100,000+ for Providing an Abortion",https://substack.com/home/post/p-157161676?utm_campaign=post&utm_medium=web
ALAR INVESTOR ALERT: Alarum Technologies Ltd. Investors with Substantial Losses Have Opportunity to Lead Class Action Lawsuit,https://www.prnewswire.com/news-releases/alar-investor-alert-alarum-technologies-ltd-investors-with-substantial-losses-have-opportunity-to-lead-class-action-lawsuit-302377427.html
Real Estate Executive Kevin Gao Charged in $30 Million Bank Fraud,https://www.msn.com/en-us/money/realestate/real-estate-executive-kevin-gao-charged-in-30-million-bank-fraud/ar-AA1z2k6T
Title,URL
Expert blasts Fla. teacher for response after backlash for showing Disney movie to class,https://thenationaldesk.com/top-videos/expert-blasts-fla-teacher-for-response-after-backlash-for-showing-disney-movie-to-class-gay-character-in-film-strange-world-jenna-barbee-parents-give-up-rights-when-they-send-their-kids-to-public-schools-investigation-education?jw_start={seek_to_second_number}
BT is DOWN: Company issues statement as thousands of customers report internet outages and being unable to acc,https://www.dailymail.co.uk/news/article-14400637/BT-thousands-customers-report-internet-outages-unable-access-emails.html
Armie Hammer speaks up and rejects cannibal allegations,https://www.gamereactor.eu/armie-hammer-speaks-up-and-rejects-cannibal-allegations-1495503/
Ripple (XRP) Price Faces Turmoil: Will Legal Clarity Spark a Rebound? – Coin Trading,https://www.hpbl.co.in/news/ripple-xrp-price-faces-turmoil-will-legal-clarity-spark-a-rebound/
Title,URL
France PM vows to help probe boarding school paedophilia allegations,https://www.communitynewspapergroup.com/news/nation/france-pm-vows-to-help-probe-boarding-school-paedophilia-allegations/article_9fcc6db9-f216-5b6d-8a10-14178a711aa7.html
Tarver Elementary teacher placed on leave amid misconduct allegations,https://www.yahoo.com/news/tarver-elementary-teacher-placed-leave-225803697.html
Justin Baldoni seeks escape as Blake Lively legal drama heats up,https://www.thenews.com.pk/latest/1283204-justin-baldoni-seeks-escape-as-blake-lively-legal-drama-heats-up
DOJ files motion to dismiss charges against NYC mayor,https://www.yahoo.com/news/doj-files-motion-dismiss-charges-122814701.html
"DOGE wins access to sensitive Labor Department, HHS and CFPB data from federal judge",https://nypost.com/2025/02/15/us-news/doge-wins-access-to-sensitive-labor-hhs-and-cfpb-data-from-federal-judge/
"APLT Deadline: Rosen Law Firm Urges Applied Therapeutics, Inc. (NASDAQ: APLT) Investors to Contact the Firm for Information About Their Rights",https://www.businesswire.com/news/home/20250215649914/en/APLT-Deadline-Rosen-Law-Firm-Urges-Applied-Therapeutics-Inc.-NASDAQ-APLT-Investors-to-Contact-the-Firm-for-Information-About-Their-Rights
TMDX INVESTOR ALERT: Robbins Geller Rudman & Dowd LLP,https://www.globenewswire.com/news-release/2025/02/15/3026933/0/en/TMDX-INVESTOR-ALERT-Robbins-Geller-Rudman-Dowd-LLP-Announces-that-TransMedics-Group-Inc-Investors-with-Substantial-Losses-Have-Opportunity-to-Lead-the-TransMedics-Class-Action-Laws.html
New Lawsuit Challenges Starbucks’ DEI Policy – 5 Keys to Watch,https://www.hrmorning.com/news/new-lawsuit-starbucks-dei-policy/
Immigration firm owner arrested for fraud,https://timesofindia.indiatimes.com/city/chandigarh/immigration-firm-owner-arrested-for-fraud/articleshow/118285270.cms
Infosys Faces Backlash After Mass Layoffs Of Trainees,https://evrimagaci.org/tpg/infosys-faces-backlash-after-mass-layoffs-of-trainees-197877
Over $1.4 million embezzled from Hardware Sales in Bellingham,https://www.aol.com/over-1-4-million-embezzled-171636956.html
BT is DOWN: thousands of customers report internet outages,https://www.dailymail.co.uk/news/article-14400637/BT-thousands-customers-report-internet-outages-unable-access-emails.html
Principal of top Pretoria school to face six charges of misconduct at disciplinary hearing,https://www.news24.com/news24/southafrica/news/principal-of-top-pretoria-school-to-face-six-charges-of-misconduct-at-disciplinary-hearing-20250215
Lawsuit on Gender Dysphoria Classification Won't Affect Student Disability Services in South Dakota,https://www.mykxlg.com/news/state/lawsuit-on-gender-dysphoria-classification-wont-affect-student-disability-services-in-south-dakota/article_2f00db98-ebcf-11ef-903e-bf8f061ebf51.html
Sexual Assault Lawsuit Against Jay-Z And Diddy Dropped By Jane Doe,https://www.blackenterprise.com/sexual-assault-lawsuit-against-jay-z-diddy-dismissed-by-jane-doe/
"Religious Organizations Including Jews, Catholics, Mennonites, File Lawsuit To Prevent Immigration Raids In Houses Of Worship",https://www.msn.com/en-us/news/us/religious-organizations-including-jews-catholics-mennonites-file-lawsuit-to-prevent-immigration-raids-in-houses-of-worship/ar-AA1yQuUn?ocid=iehp
"March 31, 2025 Deadline: Contact The Gross Law Firm to Join Class Action Suit Against GO",https://www.morningstar.com/news/pr-newswire/20250213ny18142/march-31-2025-deadline-contact-the-gross-law-firm-to-join-class-action-suit-against-go
Cedar City Man Arrested Following Multiple Allegations of Sexual Assault,https://ironcountytoday.com/2025/02/15/cedar-city-man-arrested-following-multiple-allegations-of-sexual-assault/
Man Charged in CEO's Death Posts Thanks on New Website,https://www.newser.com/story/364332/man-charged-in-ceos-death-posts-thanks-on-new-website.html
Video DOJ files motion to dismiss charges against NYC mayor,https://abcnews.go.com/Politics/video/doj-files-motion-dismiss-charges-nyc-mayor-118860869
"Ford, 13 other state AGs, file suit to strip Musk of executive access",http://www.msn.com/en-us/news/politics/ford-13-other-state-ags-file-suit-to-strip-musk-of-executive-access/ar-AA1z0ttK?apiversion=v2&noservercache=1&domshim=1&renderwebcomponents=1&wcseo=1&batchservertelemetry=1&noservertelemetry=1
"NOVELIST, MUSICIAN AND PIONEER HITS NEW MILESTONE - 80-YEAR-OLD RICK BLEIWEISS SAYS ""DREAM BIGGER""",https://www.prnewswire.com/news-releases/novelist-musician-and-pioneer-hits-new-milestone--80-year-old-rick-bleiweiss-says-dream-bigger-302377562.html
Pantera Founder Faces $850M Tax Investigation: Puerto Rico Tax Haven in the Crosshairs,https://www.cryptoninjas.net/news/pantera-founder-faces-850m-tax-investigation-puerto-rico-tax-haven-in-the-crosshairs/
Jay-Z's Lawyer Issues Statement After Tony Buzbee Drops Hov's Sexual Assault Lawsuit,https://www.hotnewhiphop.com/885829-jay-z-lawyer-statement-sexual-assault-lawsuit-dropped-hip-hop-news
"Coast Guard hit with data breach, impacting pay for more than 1,100 members",https://taskandpurpose.com/military-life/coast-guard-data-breach-pay/
Deputy accused of misconduct with inmate at St. Louis Justice Center,https://fox2now.com/news/missouri/deputy-accused-of-misconduct-with-inmate-at-st-louis-justice-center/
Judge blocks CFPB firings amid Treasury labor union lawsuit,https://www.housingwire.com/articles/judge-blocks-cfpb-firings-amid-treasury-labor-union-lawsuit/
Layoffs halted at CFPB for now as judge considers union’s lawsuit,https://www.washingtonpost.com/business/2025/02/15/cfpb-layoffs-halted/
FMC Purchasers Have Opportunity to Lead FMC Corporation Securities Fraud Lawsuit,https://www.prnewswire.com/news-releases/fmc-purchasers-have-opportunity-to-lead-fmc-corporation-securities-fraud-lawsuit-302377223.html
Burton’s Udoka Godwin-Malife suffers alleged racist abuse at Bristol Rovers,https://www.irishnews.com/sport/soccer/burtons-udoka-godwin-malife-suffers-alleged-racist-abuse-at-bristol-rovers-5G4APN5BUJKONIT4YXZSYE3CYM/
François Bayrou battles to contain scandal,https://www.france24.com/en/video/20250215-fran%C3%A7ois-bayrou-battles-to-contain-scandal
INVESTOR ALERT: Class Action Lawsuit Filed on Behalf of FMC,https://www.globenewswire.com/news-release/2025/02/14/3026771/0/en/investor-alert-class-action-lawsuit-filed-on-behalf-of-fmc-corporation-fmc-investors-holzer-holzer-llc-encourages-investors-with-significant-losses-to-contact-the-firm.html
"French PM vows to help probe boarding school abuse allegations, repeats he was 'not aware'",https://www.lemonde.fr/en/france/article/2025/02/15/french-pm-vows-to-help-probe-boarding-school-abuse-allegations-repeats-he-was-not-aware_6738201_7.html
Ivan Ayuso sentenced to five years for embezzling over $1M from GOB,https://www.breakingbelizenews.com/2025/02/15/ivan-ayuso-sentenced-to-five-years-for-embezzling-over-1m-from-gob/
ED facilitates restitution of 31 cr properties to SBI in PMLA case,https://timesofindia.indiatimes.com/city/hyderabad/ed-facilitates-restitution-of-31-cr-properties-to-sbi-in-pmla-case/articleshow/118284249.cms
CDK Global files lawsuit against Tekion over alleged cyber hacking campaign,https://www.yahoo.com/finance/news/cdk-global-files-lawsuit-against-191842547.html
"$HAREHOLDER ALERT: The M&A Class Action Firm Continues To Investigate The Merger - EVGR, QTRX, RKDA, EBTC",https://www.prnewswire.com/news-releases/hareholder-alert-the-ma-class-action-firm-continues-to-investigate-the-merger--evgr-qtrx-rkda-ebtc-302377462.html
Investment Fraud Suit Brought By Brokers Blocked By The Supremes,https://www.wealthmanagement.com/wealth-management-industry-trends/investment-fraud-suit-brought-by-brokers-blocked-by-the-supremes
Investment Advisor Gets More Than Five Years in Prison for Securities Fraud,https://www.wealthmanagement.com/regulation-compliance/investment-advisor-gets-more-than-five-years-in-prison-for-securities-fraud
Bank General Manager Arrested for Siphoning Rs 122 Crore,https://www.deccanchronicle.com/nation/crime/bank-general-manager-arrested-for-siphoning-rs-122-crore-1861499
"New lawsuit seeks to limit Alaska Native tribes’ authority, stop Eklutna gambling hall",https://www.chilkatvalleynews.com/2025/02/15/new-lawsuit-seeks-to-limit-alaska-native-tribes-authority-stop-eklutna-gambling-hall/
TGT Investors Have Opportunity to Lead Target Corporation Securities Fraud Lawsuit,https://www.morningstar.com/news/pr-newswire/20250215dc19920/tgt-investors-have-opportunity-to-lead-target-corporation-securities-fraud-lawsuit
Law firm ordered to pay £30k after falling foul of money laundering risk rules,https://www.lancs.live/news/lancashire-news/law-firm-ordered-pay-30k-30939354
"Investors in ModivCare Inc. Should Contact The Gross Law Firm Before March 31, 2025 to Discuss Your Rights - MODV",https://www.morningstar.com/news/pr-newswire/20250213ny18143/investors-in-modivcare-inc-should-contact-the-gross-law-firm-before-march-31-2025-to-discuss-your-rights-modv
"The Gross Law Firm Reminds Shareholders of a Lead Plaintiff Deadline of March 18, 2025 in Block, Inc. Lawsuit – XYZ",https://www.globenewswire.com/news-release/2025/02/12/3025319/0/en/The-Gross-Law-Firm-Reminds-Shareholders-of-a-Lead-Plaintiff-Deadline-of-March-18-2025-in-Block-Inc-Lawsuit-XYZ.html
