Title,URL
Copemish man's lawsuit over Benzie rights violations nears settlement,https://www.manisteenews.com/news/article/michigan-man-s-benzie-county-rights-violation-20165876.php
Former defense contractor CEO sentenced for COVID-relief fraud,https://www.hawaiinewsnow.com/2025/02/14/former-defense-contractor-ceo-sentenced-covid-relief-fraud/
Neon Machines settles lawsuit with former investors,https://venturebeat.com/games/neon-machines-settles-lawsuit-with-former-investors/
Lawsuit alleges Oregon ballot measure for cannabis industry unions is unconstitutional,https://www.koin.com/news/oregon/lawsuit-alleges-oregon-ballot-measure-for-cannabis-industry-unions-is-unconstitutional/
RAM Diesel Lawsuit Against FCA And Cummins Moves Forward,https://www.carscoops.com/2025/02/ram-diesel-lawsuit-against-fca-and-cummins-moves-forward/
Mexico threatens US gunmakers with fresh legal action,https://www.newspressnow.com/tn_exchange/mexico-threatens-us-gunmakers-with-fresh-legal-action/article_7c4991e8-de5f-5019-b9c9-27f97c2bf414.html
BakerHostetler Can't Keep Ga. Malpractice Suit In Fed. Court,https://www.law360.com/articles/2298552/bakerhostetler-can-t-keep-ga-malpractice-suit-in-fed-court
Royal allegedly abused TV presenter,https://www.news.com.au/entertainment/celebrity-life/royals/norways-crown-princess-son-marius-borg-hiby-faces-new-allegations/news-story/5ffece740be5f26311aa95dc21a7c15d
FIA nabs suspect in visa fraud case,https://tribune.com.pk/story/2528595/fia-nabs-suspect-in-visa-fraud-case
Man City 'beat' Premier League in legal battle with serious impact on rival clubs,https://uk.sports.yahoo.com/news/man-city-beat-premier-league-181942431.html
Fraud Alert: The SVG Image File Scam You Need To Watch Out for,https://www.moneylife.in/article/fraud-alert-the-svg-image-file-scam-you-need-to-watch-out-for/76388.html
"Dearborn orders Fairlane Town Center snowplowed, saying owner failed to do so",https://www.freep.com/story/money/business/2025/02/14/dearborn-fairlane-mall-failure-to-plow/78624110007/
Kash Patel Failed to Disclose Companies Involved in a Million-Dollar Land Deal,https://www.motherjones.com/politics/2025/02/kash-patel-donald-trump-fbi-confirmation-financial-disclosure-marbury-shahin/
YouTuber Logan Paul Challenges Messi to Boxing Bout Amid Legal Dispute,https://www.footboom1.com/en/news/football/2376656-youtuber-logan-paul-challenges-messi-to-boxing-bout-amid-legal-dispute
Yummy Dino Buddies chicken nuggets class action alleges false ‘all natural’ claims,https://topclassactions.com/lawsuit-settlements/lawsuit-news/yummy-dino-buddies-chicken-nuggets-class-action-alleges-false-all-natural-claims/
"HUD faces massive staff cuts, while a lawsuit buys time for CFPB",https://www.realestatenews.com/2025/02/14/hud-faces-massive-staff-cuts-while-a-lawsuit-buys-time-for-cfpb
"John Stankey elected Chairman of AT&T's Board of Directors, William Kennard named Lead Independent Director",https://www.prnewswire.com/news-releases/john-stankey-elected-chairman-of-atts-board-of-directors-william-kennard-named-lead-independent-director-302377364.html
The Shyft Group Announces Quarterly Dividend,https://www.prnewswire.com/news-releases/the-shyft-group-announces-quarterly-dividend-302377305.html
VULCAN INCREASES QUARTERLY DIVIDEND ON COMMON STOCK,https://www.prnewswire.com/news-releases/vulcan-increases-quarterly-dividend-on-common-stock-302377320.html
Lear Declares Quarterly Cash Dividend,https://www.prnewswire.com/news-releases/lear-declares-quarterly-cash-dividend-302377229.html
MDU Resources Announces Plans to Invest in Badger Wind Farm,https://www.prnewswire.com/news-releases/mdu-resources-announces-plans-to-invest-in-badger-wind-farm-302377172.html
"Citius Oncology, Inc. Reports Fiscal First Quarter 2025 Financial Results and Provides Business Update",https://www.prnewswire.com/news-releases/citius-oncology-inc-reports-fiscal-first-quarter-2025-financial-results-and-provides-business-update-302377259.html
"Clear Channel Outdoor Holdings, Inc. to Participate in J.P. Morgan's 2025 Global Leveraged Finance Conference",https://www.prnewswire.com/news-releases/clear-channel-outdoor-holdings-inc-to-participate-in-jp-morgans-2025-global-leveraged-finance-conference-302376631.html
"$40K Embezzled From Preschool Spent On Luxury Goods, Vacations: Cops",https://patch.com/new-york/midhudsonvalley/40k-embezzled-preschool-spent-luxury-goods-vacations-cops
"Caribou Biosciences, Inc. Sued for Securities Law Violations - Contact The Gross Law Firm Before February 24, 2025 to Discuss Your Rights - CRBU",https://www.morningstar.com/news/pr-newswire/20250213ny18090/caribou-biosciences-inc-sued-for-securities-law-violations-contact-the-gross-law-firm-before-february-24-2025-to-discuss-your-rights-crbu
Attorney General Josh Kaul Issues Statement in Case Involving DOGE’s Access to Confidential Treasury Data,https://www.weau.com/2025/02/14/attorney-general-josh-kaul-issues-statement-case-involving-doges-access-confidential-treasury-data/
Former Albuquerque property manager settles sexual harassment lawsuit,https://www.aol.com/former-albuquerque-property-manager-settles-191815176.html
Alleged Sexual Harassment: Nothing Found On UNICAL Professor’s Phone – Forensic Analyst,https://www.channelstv.com/2025/02/14/alleged-sexual-harassment-nothing-found-in-unical-professors-phone-forensic-analyst/
Charges against former West Virginia city clerk accused of embezzlement dropped without prejudice to allow further investigation,https://www.wtrf.com/top-stories/charges-against-former-west-virginia-city-clerk-accused-of-embezzlement-dropped-without-prejudice-to-allow-further-investigation/
West Sub’s revoked accreditation leaves medical residents uncertain about future,https://www.oakpark.com/2025/02/14/west-subs-revoked-accreditation-leaves-medical-residents-uncertain-about-future/
Johnson City commissioners vote unanimously to approve settlement in bribery lawsuit,https://www.wbir.com/video/news/crime/johnson-city-commissioners-vote-unanimously-to-approve-settlement-in-bribery-lawsuit/51-bdd63d4e-5dee-45e6-894e-769262b93de9
"Oyo Kingmakers Write Federal High Court, Allege Governor Makinde's Plot To Unlawfully Arrest, Detain Them",https://saharareporters.com/2025/02/14/oyo-kingmakers-write-federal-high-court-allege-governor-makindes-plot-unlawfully-arrest
NMSP officer placed on leave amid DWI scandal,https://www.koat.com/article/new-mexico-state-police-dwi-scandal-toby-lafave/63801594
Former Labour adviser brands Rachel Reeves LinkedIn scandal 'so embarrassing',https://www.gbnews.com/news/video-labour-adviser-brands-rachel-reeves-linkedin-scandal-embarrassing
The RAF cancer scandal that killed Prince William’s flying instructor,https://www.telegraph.co.uk/news/2025/02/14/raf-cancer-scandal-killed-prince-williams-flying-instructor/
Missouri sues Starbucks over its diversity programs,https://www.fastcompany.com/91279420/missouri-sues-starbucks-over-its-diversity-programs
"""Find a coward to file your motion"": Adams prosecutor resigns after being asked to drop charges",https://www.salon.com/2025/02/14/find-a-coward-to-file-your-motion-adams-prosecutor-resigns-after-being-asked-to-drop-charges/
Parents of Knoxville woman who died in 2023 allege in lawsuit her husband killed her,https://www.wbir.com/video/news/local/parents-of-knoxville-woman-who-died-in-2023-allege-in-lawsuit-her-husband-killed-her/51-532ad64d-c22a-4a09-b9cf-582d7d421a62
Twenty red states back DOGE in lawsuit challenging access to Treasury system,https://iowacapitaldispatch.com/briefs/twenty-red-states-back-doge-in-lawsuit-challenging-access-to-treasury-system/
Utah's AG addresses concerns about lawsuit that could change Section 504 accommodations,https://kslnewsradio.com/elections-politics-government/utahs-ag-addresses-concerns-about-lawsuit-that-could-change-section-504-accommodations/2183837/
"Idexx Laboratories Director Resigns, Board Size Reduced",https://www.tipranks.com/news/company-announcements/idexx-laboratories-director-resigns-board-size-reduced
Two new suspects added to Steinhoff fraud case,https://smilefm.co.za/two-new-suspects-added-to-steinhoff-fraud-case/
Police: New York man allegedly involved in Palmyra hit-and-run hid in a trash can,http://www.msn.com/en-us/news/crime/police-new-york-man-allegedly-involved-in-palmyra-hit-and-run-hid-in-a-trash-can/ar-AA1yCBTo?apiversion=v2&noservercache=1&domshim=1&renderwebcomponents=1&wcseo=1&batchservertelemetry=1&noservertelemetry=1
Explained: Manchester City's legal battle with Premier League over financial rules,https://www.skysports.com/football/video/33727/13309539/explained-manchester-citys-legal-battle-with-premier-league-over-financial-rules
Man City win huge legal battle against Premier League,https://www.msn.com/en-ie/sports/football/man-city-win-huge-legal-battle-against-premier-league/ar-AA1z4DbV
Future of Toronto's historic El Mocambo threatened by legal battle,https://www.blogto.com/music/2025/02/toronto-historic-el-mocambo-legal-battle/
"Kessler Topaz Meltzer & Check, LLP Class Action Announcement NMRA: A Securities Fraud Class Action Lawsuit Was Filed Against Neumora Therapeutics, Inc. (NMRA)",https://www.businesswire.com/news/home/20250214397216/en/Kessler-Topaz-Meltzer-Check-LLP-Class-Action-Announcement-NMRA-A-Securities-Fraud-Class-Action-Lawsuit-Was-Filed-Against-Neumora-Therapeutics-Inc.-NMRA
"ONE Gas to Participate in UBS, Morgan Stanley, and Jefferies Conferences",https://www.prnewswire.com/news-releases/one-gas-to-participate-in-ubs-morgan-stanley-and-jefferies-conferences-302377236.html
"Karman Announces Closing of its Upsized Initial Public Offering, with Full Exercise of Over-Allotment Option",https://www.prnewswire.com/news-releases/karman-announces-closing-of-its-upsized-initial-public-offering-with-full-exercise-of-over-allotment-option-302377299.html
Sealed Air Announces Leadership Changes and Re-affirms Full Year 2024 Outlook,https://www.prnewswire.com/news-releases/sealed-air-announces-leadership-changes-and-re-affirms-full-year-2024-outlook-302377234.html
SUBURBAN PROPANE AND NASCAR UNVEIL PROPANE-POWERED TRACK DRYER AT THE DAYTONA 500,https://www.prnewswire.com/news-releases/suburban-propane-and-nascar-unveil-propane-powered-track-dryer-at-the-daytona-500-302377345.html
AMGEN TO PRESENT AT CITI'S 2025 VIRTUAL ONCOLOGY LEADERSHIP SUMMIT,https://www.prnewswire.com/news-releases/amgen-to-present-at-citis-2025-virtual-oncology-leadership-summit-302377151.html
"Harley-Davidson, Inc. Declares Dividend",https://www.prnewswire.com/news-releases/harley-davidson-inc-declares-dividend-302377264.html
2025 CHICAGO AUTO SHOW HEADS INTO FINAL WEEKEND,https://www.prnewswire.com/news-releases/2025-chicago-auto-show-heads-into-final-weekend-302377326.html
"Bradford Health Services Opposes New Veteran Focused Healthcare Center, which is Backed by Coast to Coast Charitable Corporation",https://www.prnewswire.com/news-releases/bradford-health-services-opposes-new-veteran-focused-healthcare-center-which-is-backed-by-coast-to-coast-charitable-corporation-302377324.html
100-year-old Global Faith Leader Announces an Open House Celebration for the Salt Lake Temple,https://www.prnewswire.com/news-releases/100-year-old-global-faith-leader-announces-an-open-house-celebration-for-the-salt-lake-temple-302377110.html
INTRODUCING SIMPLE THEORY WINE CO: MILLENNIAL AND GEN Z COUSINS MAKING EUROPEAN VARIETAL WINES LAUNCH NEW WINERY AND TASTING LOUNGE IN MARYLAND WINE COUNTRY,https://www.prnewswire.com/news-releases/introducing-simple-theory-wine-co-millennial-and-gen-z-cousins-making-european-varietal-wines-launch-new-winery-and-tasting-lounge-in-maryland-wine-country-302377142.html
Sotheby's International Realty Expands in Tennessee,https://www.prnewswire.com/news-releases/sothebys-international-realty-expands-in-tennessee-302373604.html
ALAR INVESTOR ALERT: Robbins Geller Rudman & Dowd LLP,https://www.globenewswire.com/news-release/2025/02/14/3026860/0/en/ALAR-INVESTOR-ALERT-Robbins-Geller-Rudman-Dowd-LLP-Announces-that-Alarum-Technologies-Ltd-Investors-with-Substantial-Losses-Have-Opportunity-to-Lead-the-Alarum-Technologies-Class-A.html
"INVESTOR ALERT: Faruqi & Faruqi, LLP Investigates Claims on Behalf of Investors of Integral Ad Science",https://www.streetinsider.com/Newsfile/INVESTOR+ALERT%3A+Faruqi+%26+Faruqi%2C+LLP+Investigates+Claims+on+Behalf+of+Investors+of+Integral+Ad+Science/24350433.html
Alleged Theft of Thousands by Hudson Valley Preschool CFO Exposed,https://wrrv.com/hudson-valley-preschool-cfo-arrested-ny/
Judge rules Pittsburgh Public Schools didn't have standing to file lawsuit ordering property reassessment,http://www.msn.com/en-us/news/us/judge-rules-pittsburgh-public-schools-didn-t-have-standing-to-file-lawsuit-ordering-property-reassessment/ar-AA1z0wmG?apiversion=v2&noservercache=1&domshim=1&renderwebcomponents=1&wcseo=1&batchservertelemetry=1&noservertelemetry=1
"Navi founder and CEO Sachin Bansal resigns, company appoints new CEOs",https://indianstartupnews.com/news/navi-founder-and-ceo-sachin-bansal-resigns-company-appoints-new-ceos-8721804
Christian counselors’ lawsuit challenges ordinances against ‘conversion therapy’,https://www.baptistpress.com/resource-library/news/christian-counselors-lawsuit-challenges-ordinances-against-conversion-therapy/
Tennessee city to pay $28M to settle class action lawsuit in case of alleged serial rapist,https://www.tennessean.com/story/news/crime/2025/02/14/johnson-city-to-pay-28m-to-settle-class-action-lawsuit-sean-williams-case/78630770007/
"MODV Investor Alert: A Securities Fraud Class Action Lawsuit Has Been Filed Against ModivCare Inc. (MODV) - Contact Kessler Topaz Meltzer & Check, LLP",https://www.businesswire.com/news/home/20250214614776/en/MODV-Investor-Alert-A-Securities-Fraud-Class-Action-Lawsuit-Has-Been-Filed-Against-ModivCare-Inc.-MODV---Contact-Kessler-Topaz-Meltzer-Check-LLP
AG Alan Wilson changes stance on disability civil rights lawsuit following grassroots advocacy,https://www.wistv.com/2025/02/14/ag-alan-wilson-changes-stance-disability-civil-rights-lawsuit-following-grassroots-advocacy/
CFPB's acting director was illegally appointed: Lawsuit,https://www.americanbanker.com/news/cfpbs-acting-director-was-illegally-appointed-lawsuit
Vegas business owner indicted for allegedly running cryptocurrency Ponzi scheme,https://www.kolotv.com/2025/02/14/vegas-business-owner-indicted-allegedly-running-cryptocurrency-ponzi-scheme/
Legal Action Initiated Against 50 Social Media Accounts For Spreading Misinformation On Maha Kumbh,https://www.msn.com/en-in/news/India/legal-action-initiated-against-50-social-media-accounts-for-spreading-misinformation-on-maha-kumbh/ar-AA1z24oq
‘False Allegations’: Philip Agbese Demands Binance Executive Provide Bribery Evidence or Face Legal Action,https://www.arise.tv/false-allegations-philip-agbese-demands-binance-executive-provide-bribery-evidence-or-face-legal-action/
No credibility! Baseless allegations that Bolt’s money did not reach SSL – Says Attorney.,https://iriefm.net/no-credibility-baseless-allegations-that-bolts-money-did-not-reach-ssl-says-attorney/
"Florida Attorney Indicted for Bribery and Fraud in Manhattan, Accused of Paying Off DEA Agent for Confidential Info",https://hoodline.com/2025/02/florida-attorney-indicted-for-bribery-and-fraud-in-manhattan-accused-of-paying-off-dea-agent-for-confidential-info/
Employees helming the U.S. nuclear stockpile among those terminated,https://www.nextgov.com/modernization/2025/02/employees-helming-us-nuclear-stockpile-among-those-terminated/403035/
"AHF Products' CEO resigns, interim CEO named",https://www.woodworkingnetwork.com/news/woodworking-industry-news/ahf-products-ceo-resigns-interim-ceo-named
"Southern California business owner defrauded millions from clients, evaded taxes",https://www.msn.com/en-us/news/crime/southern-california-business-owner-defrauded-millions-from-clients-evaded-taxes/ar-AA1yDrZM?ocid=Peregrine
Man City win legal battle against Premier League's 'unlawful' sponsorship rules as English top-flight fears huge compensation claims from clubs,https://www.goal.com/en-gb/lists/man-city-win-legal-battle-premier-league-unlawful-sponsorship-rules-english-compensation-claims-clubs/blt461842ce4c0d21ba
Independent Commission Backs Manchester City in Legal Dispute with the Premier League,https://www.footboom1.com/en/news/football/2376511-independent-commission-backs-manchester-city-in-legal-dispute-with-the-premier-league
Whistleblower accuses TSMC of job discrimination. Chip company calls allegations 'lurid',https://www.azcentral.com/story/money/business/2025/02/14/tsmc-wants-lurid-stories-cut-from-job-discrimination-lawsuit-what-we-know/78613889007/
There is Love in the Air as Avelo Airlines Celebrates Valentine's Day with Free and Discounted Flights,https://www.prnewswire.com/news-releases/there-is-love-in-the-air-as-avelo-airlines-celebrates-valentines-day-with-free-and-discounted-flights-302377325.html
FDA Approves First Rapid-Acting Insulin Biosimilar Product for Treatment of Diabetes,https://www.prnewswire.com/news-releases/fda-approves-first-rapid-acting-insulin-biosimilar-product-for-treatment-of-diabetes-302377321.html
AANP Supports Legislation Strengthening Patient Access to Health Care,https://www.prnewswire.com/news-releases/aanp-supports-legislation-strengthening-patient-access-to-health-care-302377313.html
Tori Spelling faces backlash after stripping down for massage from son,https://torontosun.com/entertainment/celebrity/tori-spelling-faces-backlash-after-stripping-down-for-massage-from-son
"Bay St. Louis woman charged with credit card fraud, embezzlement",https://www.wxxv25.com/bay-st-louis-woman-charged-with-credit-card-fraud-embezzlement/
"2025-02-14 | Levi & Korsinsky Reminds Shareholders of a Lead Plaintiff Deadline of March 25, 2025 in Novo Nordisk A/S Lawsuit - NVO | NYSE:NVO | Press Release",https://stockhouse.com/news/press-releases/2025/02/14/levi-korsinsky-reminds-shareholders-of-a-lead-plaintiff-deadline-of-march-22
Knox County School Board chair defends support for school vouchers after backlash,http://www.msn.com/en-us/news/us/knox-county-school-board-chair-defends-support-for-school-vouchers-after-backlash/ar-AA1z0KT7?apiversion=v2&noservercache=1&domshim=1&renderwebcomponents=1&wcseo=1&batchservertelemetry=1&noservertelemetry=1
Settlement reached in mill town’s multi-million dollar lawsuit,https://www.rockymounttelegram.com/news/state/settlement-reached-in-mill-town-s-multi-million-dollar-lawsuit/article_aaaa8416-2229-5805-876b-158c4c5fcb54.html
Enbridge CEO: Tariffs Not a Concern but Present Chance for Reform in Canada,https://www.hartenergy.com/exclusives/enbridge-ceo-tariffs-not-concern-present-chance-reform-canada-212035
Netflix Finally Comments on ‘Bummer’ ‘Emilia Perez’ Scandal,https://www.thedailybeast.com/obsessed/netflix-finally-comments-on-bummer-emilia-perez-scandal/
Removed Doctor Who episode returns to BBC iPlayer following scandal,https://www.digitalspy.com/tv/a63799405/removed-doctor-who-episode-returns-bbc-iplayer/
"Morgan Stanley Ordered to Pay $843,000 to Senior Scam Victim",https://www.thinkadvisor.com/2025/02/14/morgan-stanley-ordered-to-pay-843000-to-senior-scam-victim/
IAS Investor Alert: A Securities Fraud Class Action Lawsuit,https://www.globenewswire.com/news-release/2025/02/14/3026844/0/en/IAS-Investor-Alert-A-Securities-Fraud-Class-Action-Lawsuit-Has-Been-Filed-Against-Integral-Ad-Science-Holding-Corp-IAS-Contact-Kessler-Topaz-Meltzer-Check-LLP.html
SF Valley Man to Plead Guilty to Alleged $5.9M Ponzi Scheme,https://www.msn.com/en-us/news/crime/sf-valley-man-to-plead-guilty-to-alleged-5-9m-ponzi-scheme/ar-AA1z3Qss
Prominent Albuquerque attorney admits to running ‘DWI Enterprise’ scandal,http://www.msn.com/en-us/crime/general/prominent-albuquerque-attorney-admits-to-running-dwi-enterprise-scandal/ar-AA1yVRpK?ocid=TobArticle&apiversion=v2&noservercache=1&domshim=1&renderwebcomponents=1&wcseo=1&batchservertelemetry=1&noservertelemetry=1
"Oregon, 11 other states file lawsuit to curb Department of Government Efficiency's power",https://www.kezi.com/news/oregon-11-other-states-file-lawsuit-to-curb-department-of-government-efficiencys-power/article_9e1953fa-eb0e-11ef-8ca6-df3dfd73af79.html
Arizona Cardinals Win Lawsuit Brought by Former Team VP,https://www.sportico.com/law/analysis/2025/arizona-cardinals-michael-bidwill-terry-mcdonough-lawsuit-1234828316/
"Diddy accused of threatening, assaulting woman in 2016: Lawsuit",https://www.newsnationnow.com/crime/diddy-threatening-assaulting-woman-2016/
"Family of slain protester faces legal action, pressure in Sanandaj",https://kurdistanhumanrights.org/en/news/2025/02/14/family-of-slain-protester-faces-legal-action-pressure-in-sanandaj
NSW government agrees to settle with men who allege they were abused by teacher Helga Lam,https://www.abc.net.au/news/2025-02-15/helga-lam-civil-case-settlement-sexual-abuse-claims-nsw-teacher/104933750
"Sensitive Bank Data Set for Deletion in CFPB Purge, Ex-Aide Says",https://www.bloomberg.com/news/articles/2025-02-14/sensitive-bank-data-set-for-deletion-in-cfpb-purge-ex-aide-says
Ex-JPMorgan Atty Pleads Guilty To NYC Housing Fraud,https://www.law360.com/real-estate-authority/residential/articles/2298518/ex-jpmorgan-atty-pleads-guilty-to-nyc-housing-fraud
Fatigue failure of prefabricated crack HTPB(hydroxyl-terminated polybutadiene) propellant under strain control,https://www.nature.com/articles/s41598-024-80482-3
CFPB's new leadership begins staff purge with dozens of employees terminated,https://www.nbcphiladelphia.com/news/business/money-report/cfpbs-new-leadership-begins-staff-purge-with-dozens-of-employees-terminated/4108085/?os=io..ref%3Dapp&ref=app
FCS Football: FCS Teams That Failed To Meet Expectations In 2024,https://www.si.com/college/fcs/mvfc/fcs-football-teams-that-failed-to-meet-expectations-in-2024-sac-state-siu-uca-und-furman-howard-chattanooga
"Moss Landing battery fire: Residents sue Vistra, others for damages",https://www.siliconvalley.com/2025/02/14/monterey-county-residents-sue-vistra-others-for-damages-due-to-moss-landing-battery-fire/
"Wine Country restaurant founder embezzled money, drank $250,000 worth of wine, lawsuit alleges",https://www.msn.com/en-us/money/companies/wine-country-restaurant-founder-embezzled-money-drank-250000-worth-of-wine-lawsuit-alleges/ar-AA1yRbxK
CMS Energy Declares Quarterly Dividend on Cumulative Redeemable Perpetual Preferred Stock,https://www.prnewswire.com/news-releases/cms-energy-declares-quarterly-dividend-on-cumulative-redeemable-perpetual-preferred-stock-302377276.html
"CREFC Announces its Annual High Yield, Distressed Assets, & Servicing Conference",https://www.prnewswire.com/news-releases/crefc-announces-its-annual-high-yield-distressed-assets--servicing-conference-302377311.html
AGC of California Announces Constructor Award Winners at 2025 Installation & Awards Gala and Installs New Leadership,https://www.prnewswire.com/news-releases/agc-of-california-announces-constructor-award-winners-at-2025-installation--awards-gala-and-installs-new-leadership-302377312.html
Dignify Therapeutics Highlights Clinical Development Plans at BIO CEO & Investor Conference,https://www.prnewswire.com/news-releases/dignify-therapeutics-highlights-clinical-development-plans-at-bio-ceo--investor-conference-302377304.html
The Dechert Impact Fellowship Program Now Open to Graduating Law Students Affected by Federal Hiring Freeze,https://www.prnewswire.com/news-releases/the-dechert-impact-fellowship-program-now-open-to-graduating-law-students-affected-by-federal-hiring-freeze-302377303.html
Wonderfront Music & Arts Festival 2025 - Tickets On Sale TODAY @ 10am pst!,https://www.prnewswire.com/news-releases/wonderfront-music--arts-festival-2025---tickets-on-sale-today--10am-pst-302376717.html
Highmark Health names Mark Sevco as president of Allegheny Health Network,https://www.prnewswire.com/news-releases/highmark-health-names-mark-sevco-as-president-of-allegheny-health-network-302377237.html
DAVID YURMAN ANNOUNCES EIZA GONZÁLEZ AS GLOBAL BRAND AMBASSADOR WITH NEWEST SCULPTED CABLE CAMPAIGN,https://www.prnewswire.com/news-releases/david-yurman-announces-eiza-gonzalez-as-global-brand-ambassador-with-newest-sculpted-cable-campaign-302375359.html
Premier League issues statement after losing Man City legal battle - and Liverpool is impacted,https://uk.sports.yahoo.com/news/premier-league-issues-statement-losing-194001839.html
Senator Gallivan Issues Statement on Lockdown at Collins Correctional Facility,https://www.nysenate.gov/newsroom/press-releases/2025/patrick-m-gallivan/senator-gallivan-issues-statement-lockdown-collins?page=58
Meghan ‘upset and stressed’ over backlash,https://www.thechronicle.com.au/entertainment/celebrity-life/royals/meghan-markle-upset-and-stressed-over-backlash/news-story/558f9851238f420ebdfd619978ad7c51?amp
Torstar sues Meta for unlawful breach of contract after online news bill came into effect,https://www.theglobeandmail.com/business/article-torstar-sues-meta-for-unlawful-breach-of-contract-after-online-news/
Former Calif. 'Teacher of the Year' pleads guilty to sexual misconduct with students,https://cnycentral.com/news/nation-world/former-calif-teacher-of-the-year-pleads-guilty-to-sexual-misconduct-with-students-california-jacqueline-ma-lincoln-acres-elementary-school-san-diego-county
Attorney General Ken Paxton Stops Radical Abortionist from Unlawfully Supplying Dangerous Drugs to Kill Unborn Babies,https://thekatynews.com/2025/02/14/attorney-general-ken-paxton-stops-radical-abortionist-from-unlawfully-supplying-dangerous-drugs-to-kill-unborn-babies/
"Fires, squatting, scandal: S.F.’s last public housing gets new management",https://missionlocal.org/2025/02/sf-public-housing-bell-properties-eugene-burger/
