Title,URL
Asahi Linux lead resigns from Mac-based distro after tumultuous kernel debate,https://arstechnica.com/gadgets/2025/02/asahi-linux-lead-resigns-from-mac-based-distro-after-tumultuous-kernel-debate/
City employees file wage theft lawsuit against Seattle stemming from new payroll system,https://komonews.com/news/local/city-employees-file-wage-theft-lawsuit-against-seattle-stemming-from-new-payroll-system-workday-14-thousand-workers-class-action
"Claressa Shields Calls Out Haters And Threatens Legal Action After Failed Drug Test, PED Rumors",https://www.si.com/fannation/boxing/claressa-shields-calls-out-haters-and-threatens-legal-action-after-failed-drug-test-ped-rumors
"Del Valle Man Detained on Allegations of Injuring Toddler, Travis County Jail Awaits Determination of Charges",https://hoodline.com/2025/02/del-valle-man-detained-on-allegations-of-injuring-toddler-travis-county-jail-awaits-determination-of-charges/
Compliance check lands Folsom man behind bars on multiple drug related allegations,https://wgno.com/news/crime/compliance-check-lands-folsom-man-behind-bars-on-multiple-drug-related-allegations/
Former Yellow Springs doctor takes plea deal after allegations of patient abuse,https://www.yahoo.com/news/former-yellow-springs-doctor-takes-193700740.html
HPD opens fraud investigation into Huntsville College Preparatory School,https://www.msn.com/en-us/news/us/hpd-opens-fraud-investigation-into-huntsville-college-preparatory-school/ar-AA1yVoAK
Misconduct hearing for former officer who 'accessed records for own gain',https://www.witneygazette.co.uk/news/24927360.alleged-misconduct-oxford-police-officer-accessed-records/
Keokuk city administrator terminated following weekend OWI arrest,https://khqa.com/news/local/keokuk-city-administrator-terminated-following-weekend-owi-arrest
"News: Half of CDC ""disease detectives"" terminated. DOGE takes aim at US disease surveillance.",https://substack.com/home/post/p-157157898?utm_campaign=post&utm_medium=web
Have Blake Lively and Justin Baldoni reached an agreement of sorts? Here's what the actors told the court,https://m.economictimes.com/news/international/us/have-blake-lively-and-justin-baldoni-reached-an-agreement-of-sorts-heres-what-the-actors-told-the-court/articleshow/118253414.cms
"SEC settles misconduct charges against One Oak Capital, Michael DeRosa By Investing.com",https://au.investing.com/news/stock-market-news/sec-settles-misconduct-charges-against-one-oak-capital-michael-derosa-93CH-3678034
"Family of Kentucky man, mistakenly shot and killed by police, files lawsuit",https://www.wtvq.com/family-of-kentucky-man-mistakenly-shot-and-killed-by-police-files-lawsuit/
Popular Atlanta brewery engaged in legal dispute with Molson Coors over ‘Monday Night’ trademark,https://www.atlantanewsfirst.com/2025/02/14/popular-atlanta-brewery-engaged-legal-dispute-with-molson-coors-over-monday-night-trademark/
Valero refinery explosion sparks lawsuit by 5 men who say they were injured,https://www.expressnews.com/business/article/valero-explosion-three-rivers-lawsuit-san-antonio-20167994.php
Florida Criminal Defense Attorney Indicted for Bribing DEA Agent,https://news.bloomberglaw.com/white-collar-and-criminal-law/florida-criminal-defense-attorney-indicted-for-bribing-dea-agent
ADCOLOR Opens Nominations and Applications for 2025 Awards and Talent Programs,https://www.prnewswire.com/news-releases/adcolor-opens-nominations-and-applications-for-2025-awards-and-talent-programs-302377302.html
"Audriix Releases ""Where the Boys Are"" on February 14",https://www.prnewswire.com/news-releases/audriix-releases-where-the-boys-are-on-february-14-302376739.html
IEEE Study Reveals Breakthroughs in High-Performance Photon Detectors,https://www.prnewswire.com/news-releases/ieee-study-reveals-breakthroughs-in-high-performance-photon-detectors-302376102.html
Pregnant wife slams husband’s ‘incredible’ Valentine’s Day gift — but faces backlash: ‘Why can’t you just be happy?’,https://www.newsbreak.com/new-york-post-509648/3812338492804-pregnant-wife-slams-husband-s-incredible-valentine-s-day-gift-but-faces-backlash-why-can-t-you-just-be-happy
Fillmore County Hospital Announces Data Breach,https://www.jdsupra.com/legalnews/fillmore-county-hospital-announces-data-6078300/
Yazoo Valley Power Facing Privacy Suit Over August Data Breach,https://news.bloomberglaw.com/class-action/yazoo-valley-power-facing-privacy-suit-over-august-data-breach
WBA INVESTOR ALERT: Robbins Geller Rudman & Dowd LLP,https://www.globenewswire.com/fr/news-release/2025/02/13/3026066/0/en/WBA-INVESTOR-ALERT-Robbins-Geller-Rudman-Dowd-LLP-Announces-that-Walgreens-Boots-Alliance-Inc-Investors-with-Substantial-Losses-Have-Opportunity-to-Lead-Investor-Class-Action-Lawsu.html
Woman Convicted for Mass-Mailing Sexual Misconduct Accusations About Former Teacher,https://reason.com/volokh/2025/02/14/woman-convicted-for-mass-mailing-sexual-misconduct-accusations-about-former-teacher/
$60K in damages estimated from Shelby County house fire,https://www.yahoo.com/news/60k-damages-estimated-shelby-county-074435983.html
Settlement reached in North Dakota lawsuit alleging intimidation by white nationalist hate group,https://www.thespec.com/news/world/united-states/settlement-reached-in-north-dakota-lawsuit-alleging-intimidation-by-white-nationalist-hate-group/article_702a5c83-f590-5359-b1b8-5e62ec05ade0.html
Educational reform and what we can learn from the Enron scandal,https://www.jns.org/educational-reform-and-what-we-can-learn-from-the-enron-scandal/
"ICLR Investor Alert: A Securities Fraud Class Action Lawsuit Has Been Filed Against ICON Public Limited Company (ICLR) - Contact Kessler Topaz Meltzer & Check, LLP",https://www.prnewswire.com/news-releases/iclr-investor-alert-a-securities-fraud-class-action-lawsuit-has-been-filed-against-icon-public-limited-company-iclr---contact-kessler-topaz-meltzer--check-llp-302376692.html
"Greenfield man accused of embezzling more than $400,000 as armored truck driver",https://www.yahoo.com/news/greenfield-man-accused-embezzling-more-110839997.html
"Former SLO County probation officer accused of embezzling more than $100,000 from union",https://www.yahoo.com/news/former-slo-county-probation-officer-221235211.html
Family of Doug Harless obtain lawyer in civil lawsuit to 'seek justice' - LEX 18 News,https://www.lex18.com/we-follow-through/family-of-doug-harless-obtain-lawyer-in-civil-lawsuit-to-seek-justice
Minnesota judge: lawsuit over UnitedHealth use of AI can continue,https://insurancenewsnet.com/innarticle/minnesota-judge-lawsuit-over-unitedhealth-use-of-ai-can-continue
"Maryland woman pleads guilty to theft of over $60,000....to pay restitution in another theft case",https://tristatealert.com/maryland-woman-pleads-guilty-to-theft-of-over-60000-to-pay-restitution-in-another-theft-case/
OAG: Frederick County woman stole $65K to pay restitution in another theft case,https://www.dcnewsnow.com/news/local-news/maryland/frederick-county-md/oag-frederick-county-woman-stole-65k-to-pay-restitution-in-another-theft-case/
Woman convicted after stealing 65K to pay restitution in different case,https://www.wmar2news.com/local/woman-convicted-after-stealing-65k-to-pay-restitution-in-different-case
"Watchdogs probe DOGE’s access to Treasury payments system, Musk’s fraud allegations",https://www.politico.com/news/2025/02/14/gao-doge-treasury-payment-system-00204285
"Worcester will not probe two city councilors' allegations of transphobia, discrimination",https://www.telegram.com/story/news/local/worcester/2025/02/14/etel-haxhiaj-thu-nguyen-allegations-not-probed-by-worcester-officials/78613275007/
'Brazen criminality': Allegations of 'quid pro quo' fly after border czar’s admission,https://www.alternet.org/send/tom-homan-quid-pro-quo/
Investigation into fraud targeting small businesses,https://www.cbs19news.com/news/investigation-into-fraud-targeting-small-businesses/article_ffeef4ce-eb07-11ef-84fc-efead4c38769.html
"Federal prosecutor will sign motion to dismiss Adams charges in bid to save colleagues' jobs, sources say",https://denvergazette.com/news/nation-world/federal-prosecutor-will-sign-motion-to-dismiss-adams-charges-in-bid-to-save-colleagues-jobs/article_cb23f78d-a3a0-5af6-b7ee-9d2ec6223fc9.html
"MSU agrees to pay ousted business college dean $640,000 in new role",https://statenews.com/article/2025/02/msu-agrees-to-pay-ousted-business-college-dean-640000-in-new-role?ct=content_open&cv=cbox_latest
Man City Win Legal Battle as Premier League APT Rules Decision Made,https://www.givemesport.com/manchester-city-victory-as-premier-leagues-apt-rules-declared-void/
Waterloo schools assistant principal resigns following incident with student,https://cbs2iowa.com/news/local/waterloo-schools-assistant-principal-resigns-following-incident-with-student
Greenpeace International files lawsuit against Energy Transfer in first use of EU anti-SLAPP Directive,https://www.greenpeace.org/international/press-release/72706/greenpeace-international-files-lawsuit-against-energy-transfer-in-first-use-of-eu-anti-slapp-directive/
Sunoco LP Files 2024 Annual Report on Form 10-K,https://www.prnewswire.com/news-releases/sunoco-lp-files-2024-annual-report-on-form-10-k-302377296.html
"NeuralCure AI Announces Breakthrough in AI-Powered Healthcare, Completing Decades of Medical Research in Moments",https://www.prnewswire.com/news-releases/neuralcure-ai-announces-breakthrough-in-ai-powered-healthcare-completing-decades-of-medical-research-in-moments-302376718.html
ATLANTIS PARADISE ISLAND ANNOUNCES TALENT AND EVENTS FOR 2025 NASSAU PARADISE ISLAND WINE & FOOD FESTIVAL,https://www.prnewswire.com/news-releases/atlantis-paradise-island-announces-talent-and-events-for-2025-nassau-paradise-island-wine--food-festival-302376684.html
"Appier provides strong FY25 guidance and a sustainable, profitable growth trajectory",https://www.prnewswire.com/news-releases/appier-provides-strong-fy25-guidance-and-a-sustainable-profitable-growth-trajectory-302376916.html
"REMSA Health Experiences Cyberattack, Raising Questions of a Possible Data Breach",https://www.jdsupra.com/legalnews/remsa-health-experiences-cyberattack-7714023/
‘Price-fixing’ arrangement alleged between plant hire firms,https://www.irishtimes.com/business/2025/02/14/price-fixing-arrangement-alleged-between-plant-hire-firms/
"NJ restaurant owner accused of drugging, raping woman",https://nj1015.com/nj-restaurant-owner-carlos-erazo-caballero-accused-of-drugging-raping-woman/
"Bay St. Louis charged with credit card fraud, embezzlement",https://www.wxxv25.com/bay-st-louis-charged-with-credit-card-fraud-embezzlement/
"FMC INVESTOR ALERT: Bronstein, Gewirtz and Grossman, LLC Announces that FMC Corporation Stockholders with Substantial Losses Have Opportunity to Lead Class Action Lawsuit!",https://markets.businessinsider.com/news/stocks/fmc-investor-alert-bronstein-gewirtz-and-grossman-llc-announces-that-fmc-corporation-stockholders-with-substantial-losses-have-opportunity-to-lead-class-action-lawsuit-1034363864
Investor Alert: Robbins LLP Informs Stockholders of the Edison International Class Action,https://www.globenewswire.com/fr/news-release/2025/02/14/3026373/0/en/Investor-Alert-Robbins-LLP-Informs-Stockholders-of-the-Edison-International-Class-Action.html
Mayor Adams Case Fallout Tests DOJ Internal Misconduct Office,https://news.bloomberglaw.com/us-law-week/mayor-adams-case-fallout-tests-doj-internal-misconduct-office
"Sierra Club, WVPSC Work Toward Settlement Of Federal Lawsuit",https://wvpublic.org/sierra-club-wvpsc-work-toward-settlement-of-federal-lawsuit/
Netflix calls ‘Emilia Pérez’ scandal ‘a bummer’,https://ktla.com/entertainment/netflix-calls-emilia-perez-scandal-a-bummer/
Alanyaspor's Korean star gets suspended sentence in sex-video scandal | Daily Sabah,https://www.dailysabah.com/sports/football/alanyaspors-korean-star-gets-suspended-sentence-in-sex-video-scandal
Prince Andrew Rocked by Another Scandal After He Thought ‘He’d Put the Epstein’ One ‘Behind Him’,https://www.yahoo.com/news/prince-andrew-rocked-another-scandal-190708850.html
YouTube Channel Taldeok Camp Owner Gets Ordered To Pay 76 Million Krw Over Defaming BTS’ V & Jungkook,https://www.imdb.com/news/ni65127938/?ref_=nm_nwr_1
Title,URL
Besler launches legal action against District,https://www.pentictonherald.ca/news/article_0953afdc-eb21-11ef-9e24-cf33d5fd8edf.html
Legal action against 'stink bomb' landfill dropped,https://www.msn.com/en-us/news/world/legal-action-against-stink-bomb-landfill-dropped/ar-AA1yKdce
Misconduct allegations filed against Tarver Elementary teacher within Belton ISD,https://www.tdtnews.com/news/central_texas_news/article_a286fc44-eb22-11ef-b411-779dfa7b06a8.html
"NYC Mayor Adams calls quid pro quo allegations ""silly""",https://www.cbsnews.com/newyork/video/nyc-mayor-adams-calls-quid-pro-quo-allegations-silly/
Two Alberta private surgery clinic contracts in limbo amid allegations in scandal,https://edmontonjournal.com/news/politics/two-alberta-private-surgery-clinic-contracts-scandal
TIMELINE: A full look at the DWI corruption scandal involving several departments,https://www.koat.com/article/albuquerque-dwi-scandal-timeline/63801961
Cannabis company Aphria agrees to settle class-action lawsuit,https://calgary.citynews.ca/2025/02/10/cannabis-company-aphria-reaches-agreement-to-settle-shareholder-class-action-lawsuit/
"Legal battle ensues between Chemainus Public Market, Blake’s Fish and Chips",https://www.ladysmithchronicle.com/local-news/legal-battle-ensues-between-chemainus-public-market-blakes-fish-and-chips-7804383
"Shuffle Board: Hanesbrands CEO Departs, Levi’s Restructures C-Suite",https://sourcingjournal.com/topics/business-news/shuffle-board-hanesbrands-ceo-levis-c-suite-executive-moves-leadership-changes-1234737167/
"Clearing Firm Faces SEC Charges, Small Firm Movement Tarnished",https://www.wealthmanagement.com/wealth-management-industry-trends/clearing-firm-faces-sec-charges-small-firm-movement-tarnished
"Northampton station, gas delivery company, fined for waiting to report spill",https://www.masslive.com/westernmass/2025/02/northampton-station-gas-delivery-company-fined-for-waiting-to-report-spill.html
Oncolytics Biotech® Announces Receipt of Nasdaq Notification Letter Regarding Minimum Bid Price Deficiency,https://www.prnewswire.com/news-releases/oncolytics-biotech-announces-receipt-of-nasdaq-notification-letter-regarding-minimum-bid-price-deficiency-302377352.html
"Aslan Energy Capital Signs MOU to Supply 100,000 TPA of Sustainable Hydrogen from its Sonora, Mexico facility to California-Based CalYan XGH Inc.",https://www.prnewswire.com/news-releases/aslan-energy-capital-signs-mou-to-supply-100-000-tpa-of-sustainable-hydrogen-from-its-sonora-mexico-facility-to-california-based-calyan-xgh-inc-302377366.html
NAIC Announces 2025 Initiatives,https://www.prnewswire.com/news-releases/naic-announces-2025-initiatives-302377365.html
"IT Leaders Can Strengthen Vendor Partnerships With Business-Aligned MSP Agreements, Says Info-Tech Research Group",https://www.prnewswire.com/news-releases/it-leaders-can-strengthen-vendor-partnerships-with-business-aligned-msp-agreements-says-info-tech-research-group-302377176.html
Suspended Exxaro Resources’ CEO steps down amid governance probe,http://www.msn.com/en-us/money/companies/suspended-exxaro-resources-ceo-steps-down-amid-governance-probe/ar-AA1yCWRk?ocid=finance-verthp-feeds&apiversion=v2&noservercache=1&domshim=1&renderwebcomponents=1&wcseo=1&batchservertelemetry=1&noservertelemetry=1
"Coast Guard Suffers Data Breach, Pay Delayed for 1,135 Members",https://news.usni.org/2025/02/14/coast-guard-suffers-data-breach-pay-delayed-for-1135-members
Title,URL
"GO INVESTOR ALERT: Bronstein, Gewirtz and Grossman, LLC Announces that Grocery Outlet Holding Corp. Investors Have Opportunity to Lead Class Action Lawsuit!",https://markets.businessinsider.com/news/stocks/go-investor-alert-bronstein-gewirtz-and-grossman-llc-announces-that-grocery-outlet-holding-corp-investors-have-opportunity-to-lead-class-action-lawsuit-1034362052
County sues Dayton’s Water Department for alleged ‘breach of contract’,https://www.wdtn.com/top-stories/county-sues-daytons-water-department-for-alleged-breach-of-contact/
Montgomery County sues City of Dayton Water Department for breach of contract,https://www.whio.com/news/local/county-sues-city-water-department-breach-contract/HHKYSGJYDND2VNY66QRNECHTSY/
Republicans Target $100 Billion in Alleged COVID-Era Unemployment Fraud,https://dailyfly.com/republicans-target-100-billion-in-alleged-covid-era-unemployment-fraud/
Tarver Elementary teacher placed on leave after allegations of misconduct,https://www.kcentv.com/article/news/crime/tarver-elementary-teacher-placed-leave-allegations-misconduct/500-b480a191-9ade-4970-b0de-1f5d4d9cd3fb
Alberta cabinet minister calls for removal of health minister amid corruption scandal,https://www.theglobeandmail.com/canada/alberta/article-alberta-cabinet-minister-calls-for-removal-of-health-minister-amid/
CEO charged by NCD Police,https://www.postcourier.com.pg/ceo-charged-by-ncd-police/
AG Jackley States Lawsuit Will Not Eliminate Section 504 School Disability Accommodations,https://news.sd.gov/news?id=news_kb_article_view&sys_id=9e0a23101bbf5e90f6142062f54bcb53
Wayne County deputy awarded $1.7M in lawsuit against driver who hit hit while directing traffic,https://www.wsmv.com/2025/02/14/wayne-county-deputy-awarded-17m-lawsuit-against-driver-who-hit-hit-while-directing-traffic/
Michigan Attorney General files brief in support of lawsuit to block transgender military ban,https://www.wlns.com/news/michigan-joins-lawsuit-to-block-transgender-military-ban/
Prof. Irina Manta Discusses Lawsuit Against AI Company for Alleged Copyright Infringement,https://lawnews.hofstra.edu/2025/02/14/prof-irina-manta-discusses-lawsuit-against-ai-company-for-alleged-copyright-infringement/
Seventh attorney resigns after refusing to dismiss case against NYC Mayor Eric Adams,https://www.bbc.com/news/articles/cn93rnnjw4zo
Farsley Celtic chairman resigns after abuse from supporters,https://www.bbc.com/news/articles/cnvqlgyq7qvo
Local lawyer arrested for harassment,https://www.thewetumpkaherald.com/news/local-lawyer-arrested-for-harassment/article_e2147ad8-eb1f-11ef-b37b-a776e2f708f0.html
Title,URL
"AG Nessel files lawsuit, calling DOGE actions unconstitutional",https://wzmq19.com/news/344781/ag-nessel-files-lawsuit-calling-doge-actions-unconstitutional/
Labaton Keller Sucharow LLP Announces Securities Class Action Lawsuit Filed Against FMC Corporation and Certain Executives,https://www.businesswire.com/news/home/20250214035779/en/Labaton-Keller-Sucharow-LLP-Announces-Securities-Class-Action-Lawsuit-Filed-Against-FMC-Corporation-and-Certain-Executives
EPIX STOCK NEWS: EPIX Shareholders with Large Losses Should,https://www.globenewswire.com/news-release/2025/02/14/3026920/0/en/EPIX-STOCK-NEWS-EPIX-Shareholders-with-Large-Losses-Should-Contact-Robbins-LLP-for-Information-About-the-Class-Action-Lawsuit-Against-Essa-Pharma-Inc.html
CROX STOCK NEWS: CROX Shareholders with Large Losses Should,https://www.globenewswire.com/news-release/2025/02/14/3026919/0/en/CROX-STOCK-NEWS-CROX-Shareholders-with-Large-Losses-Should-Contact-Robbins-LLP-for-Information-About-the-Class-Action-Lawsuit-Against-Crocs-Inc.html
Columbus jury renders verdict in $2.5 billion lawsuit against Ford Motor Company,https://www.ledger-enquirer.com/news/local/article300359299.html
"Judge rejects former Clinch Co. sheriff’s claim, rules sheriff not immune in excessive force lawsuit",https://www.walb.com/2025/02/14/judge-rejects-former-clinch-co-sheriffs-claim-rules-sheriff-not-immune-excessive-force-lawsuit/
Rosen Law Firm Urges FMC Corporation (NYSE: FMC) Stockholders to Contact the Firm for Information About Their Rights,https://www.businesswire.com/news/home/20250214623940/en/Rosen-Law-Firm-Urges-FMC-Corporation-NYSE-FMC-Stockholders-to-Contact-the-Firm-for-Information-About-Their-Rights
AANA Applauds Reintroduction of The Improving Care and Access to Nurses Act in 119th Congress,https://www.prnewswire.com/news-releases/aana-applauds-reintroduction-of-the-improving-care-and-access-to-nurses-act-in-119th-congress-302377382.html
"Consumer Watchdog Agrees With Insurance Commissioner Lara That State Farm Needs To Provide More Information Before Getting Rate Hike, But Should Be Provided in Full Hearing",https://www.prnewswire.com/news-releases/consumer-watchdog-agrees-with-insurance-commissioner-lara-that-state-farm-needs-to-provide-more-information-before-getting-rate-hike-but-should-be-provided-in-full-hearing-302377379.html
Title,URL
How losing legal battle with Man City over sponsorship rules exposed the Premier League - and why the lame duc,https://www.dailymail.co.uk/sport/football/article-14399331/How-losing-legal-battle-Man-City-sponsorship-rules-exposed-Premier-League-lame-duck-chief-executive-blame-writes-MIKE-KEEGAN.html
"NJ attorney, ritzy yacht club owner arrested for beating man in Miami club on New Year’s Day",https://www.newsbreak.com/new-york-post-509648/3808186270424-nj-attorney-ritzy-yacht-club-owner-arrested-for-beating-man-in-miami-club-on-new-year-s-day
Title,URL
Jackley clarifies the focus of multi-state Section 504 lawsuit,https://www.dakotanewsnow.com/2025/02/14/jackley-clarifies-focus-multi-state-section-504-lawsuit/
Lawsuit filed against Keller ISD alleges violations of Voting Rights Act,https://www.dallasnews.com/news/2025/02/14/lawsuit-filed-friday-against-keller-isd-alleges-violations-of-voting-rights-act/
"20 red states, including Arkansas, back DOGE in lawsuit challenging access to Treasury system",https://arkansasadvocate.com/briefs/20-red-states-including-arkansas-back-doge-in-lawsuit-challenging-access-to-treasury-system/
Prof. James Sample Explains Federal Lawsuit Against New York’s Green Light Law,https://lawnews.hofstra.edu/2025/02/14/prof-james-sample-explains-federal-lawsuit-against-new-yorks-green-light-law/
Law’s Sharona Hoffman discusses an insulin lawsuit recently filed by the City of Columbus,https://thedaily.case.edu/laws-sharona-hoffman-discusses-an-insulin-lawsuit-recently-filed-by-the-city-of-columbus/
Elmore County lawyer arrested for harassment,https://www.alexcityoutlook.com/elmore-county-lawyer-arrested-for-harassment/article_87d9737c-4b06-5dae-aa75-326147315dd6.html
Fla. Lawyer Allegedly Smashed Plate Over Fellow Wedding Attendee’s Head When He Allowed Others to Cut in Buffet Line,https://www.yahoo.com/entertainment/fla-lawyer-allegedly-smashed-plate-141907407.html
"Attorney general threatening legal action against Indianapolis authorities, schools",https://www.whas11.com/video/news/local/indiana/attorney-general-threatening-legal-action-against-indianapolis-authorities-schools/417-bcc673c1-09e4-4abc-b8fc-738431a1ec29
'Outrageous and false': How those named in the AHS lawsuit are responding to the allegations,https://edmontonjournal.com/news/politics/outrageous-and-false-how-those-named-in-the-ahs-lawsuit-are-responding-to-the-allegations
GloRilla Denies BBL Rumors as She Preps for ‘The Glorious Tour’,https://www.billboard.com/music/rb-hip-hop/glorilla-bbl-glorious-tour-1235903399/
ED seizes Rs 170-cr worth bank deposits in probe against ‘fraud’ forex trading platform,https://theprint.in/india/ed-seizes-rs-170-cr-worth-bank-deposits-in-probe-against-fraud-forex-trading-platform/2492261/
DOGE Posts — Then Redacts — What Appears to Be Sensitive HUD Contract Data,https://www.notus.org/whitehouse/doge-posts-then-redacts-sensitive-hud-contract-data
Title,URL
Tarver Elementary teacher placed on leave amid misconduct allegations - KWKT,https://www.fox44news.com/news/local-news/bell-county/tarver-elementary-teacher-placed-on-leave-amid-misconduct-allegations/
Mobile Mardi Gras queen accused of nearly $1.5M embezzlement scheme,https://mynbc15.com/news/local/mobile-mardi-gras-queen-accused-of-nearly-15m-embezzlement-scheme
Vernon business owner accused of child sex crimes - KFDX,https://www.texomashomepage.com/news/crime/vernon-business-owner-accused-of-child-sex-crimes/
Mass. daycare co-owner accused of assaulting children in her care,https://www.msn.com/en-us/news/crime/mass-daycare-co-owner-accused-of-assaulting-children-in-her-care/ar-AA1yyDPu
B1/B2 Visa Revoked -Traveler Finds Out at Airport,https://www.m9.news/usa-news/b1-b2-visa-revoked-traveler-finds-out-at-airport/
EHarley Street: Calls for inquiry into GP management 'scandal',https://www.bbc.com/news/articles/c9qj8gelgz8o
Netflix Addresses Controversy Surrounding Karla Sofía Gascón Amid ‘Emilia Pérez’ Scandal,https://www.newsx.com/entertainment/netflix-addresses-controversy-surrounding-karla-sofia-gascon-amid-emilia-perez-scandal/
Title,URL
INVESTOR ALERT: Shareholder Class Action Lawsuit Filed,https://www.globenewswire.com/de/news-release/2025/02/13/3026357/0/en/INVESTOR-ALERT-Shareholder-Class-Action-Lawsuit-Filed-Against-Newmont-Corporation-NYSE-NEM-DiCello-Levitt-LLP-Encourages-Investors-with-Losses-to-Discuss-Their-Options-with-Counsel.html
The surprising secret life of Scotland's gay king that caused scandal,https://www.heraldscotland.com/news/24925949.scandalous-secret-life-scotlands-gay-king/
Airport manager abruptly resigns after brief tenure,https://www.hccommunityjournal.com/article_a50cc2c4-e97d-11ef-9dd1-fb45b2fb9303.html
Real Madrid defender facing potential legal action over sex video scandal,https://e.vnexpress.net/news/sports/football/real-madrid-defender-facing-potential-legal-action-over-sex-video-scandal-4849951.html
SEC Seeks 28 More Days in Coinbase Legal Battle,https://www.cryptotimes.io/2025/02/15/sec-seeks-28-more-days-in-coinbase-legal-battle/
